CPU:
   0x00000000 0x00: eax=0x00000016 ebx=0x756e6547 ecx=0x6c65746e edx=0x49656e69
   0x00000001 0x00: eax=0x000906ec ebx=0x02100800 ecx=0x7ffafbff edx=0xbfebfbff
   0x00000002 0x00: eax=0x76036301 ebx=0x00f0b5ff ecx=0x00000000 edx=0x00c30000
   0x00000003 0x00: eax=0x00000000 ebx=0x00000000 ecx=0x00000000 edx=0x00000000
   0x00000004 0x00: eax=0x1c004121 ebx=0x01c0003f ecx=0x0000003f edx=0x00000000
   0x00000004 0x01: eax=0x1c004122 ebx=0x01c0003f ecx=0x0000003f edx=0x00000000
   0x00000004 0x02: eax=0x1c004143 ebx=0x00c0003f ecx=0x000003ff edx=0x00000000
   0x00000004 0x03: eax=0x1c03c163 ebx=0x03c0003f ecx=0x00003fff edx=0x00000006
   0x00000004 0x04: eax=0x00000000 ebx=0x00000000 ecx=0x00000000 edx=0x00000000
   0x00000005 0x00: eax=0x00000040 ebx=0x00000040 ecx=0x00000003 edx=0x11142120
   0x00000006 0x00: eax=0x000027f7 ebx=0x00000002 ecx=0x00000001 edx=0x00000000
   0x00000007 0x00: eax=0x00000000 ebx=0x029c67af ecx=0x40000000 edx=0xbc002e00
   0x00000008 0x00: eax=0x00000000 ebx=0x00000000 ecx=0x00000000 edx=0x00000000
   0x00000009 0x00: eax=0x00000000 ebx=0x00000000 ecx=0x00000000 edx=0x00000000
   0x0000000a 0x00: eax=0x07300404 ebx=0x00000000 ecx=0x00000000 edx=0x00000603
   0x0000000b 0x00: eax=0x00000001 ebx=0x00000002 ecx=0x00000100 edx=0x00000002
   0x0000000b 0x01: eax=0x00000004 ebx=0x00000010 ecx=0x00000201 edx=0x00000002
   0x0000000b 0x02: eax=0x00000000 ebx=0x00000000 ecx=0x00000002 edx=0x00000002
   0x0000000c 0x00: eax=0x00000000 ebx=0x00000000 ecx=0x00000000 edx=0x00000000
   0x0000000d 0x00: eax=0x0000001f ebx=0x00000440 ecx=0x00000440 edx=0x00000000
   0x0000000d 0x01: eax=0x0000000f ebx=0x000003c0 ecx=0x00000100 edx=0x00000000
   0x0000000d 0x02: eax=0x00000100 ebx=0x00000240 ecx=0x00000000 edx=0x00000000
   0x0000000d 0x03: eax=0x00000040 ebx=0x000003c0 ecx=0x00000000 edx=0x00000000
   0x0000000d 0x04: eax=0x00000040 ebx=0x00000400 ecx=0x00000000 edx=0x00000000
   0x0000000d 0x08: eax=0x00000080 ebx=0x00000000 ecx=0x00000001 edx=0x00000000
   0x0000000e 0x00: eax=0x00000000 ebx=0x00000000 ecx=0x00000000 edx=0x00000000
   0x0000000f 0x00: eax=0x00000000 ebx=0x00000000 ecx=0x00000000 edx=0x00000000
   0x00000010 0x00: eax=0x00000000 ebx=0x00000000 ecx=0x00000000 edx=0x00000000
   0x00000011 0x00: eax=0x00000000 ebx=0x00000000 ecx=0x00000000 edx=0x00000000
   0x00000012 0x00: eax=0x00000000 ebx=0x00000000 ecx=0x00000000 edx=0x00000000
   0x00000012 0x01: eax=0x00000000 ebx=0x00000000 ecx=0x00000000 edx=0x00000000
   0x00000012 0x02: eax=0x00000000 ebx=0x00000000 ecx=0x00000000 edx=0x00000000
   0x00000013 0x00: eax=0x00000000 ebx=0x00000000 ecx=0x00000000 edx=0x00000000
   0x00000014 0x00: eax=0x00000001 ebx=0x0000000f ecx=0x00000007 edx=0x00000000
   0x00000014 0x01: eax=0x02490002 ebx=0x003f3fff ecx=0x00000000 edx=0x00000000
   0x00000015 0x00: eax=0x00000002 ebx=0x0000012c ecx=0x00000000 edx=0x00000000
   0x00000016 0x00: eax=0x00000e10 ebx=0x00001388 ecx=0x00000064 edx=0x00000000
   0x20000000 0x00: eax=0x00000e10 ebx=0x00001388 ecx=0x00000064 edx=0x00000000
   0x80000000 0x00: eax=0x80000008 ebx=0x00000000 ecx=0x00000000 edx=0x00000000
   0x80000001 0x00: eax=0x00000000 ebx=0x00000000 ecx=0x00000121 edx=0x2c100800
   0x80000002 0x00: eax=0x65746e49 ebx=0x2952286c ecx=0x726f4320 edx=0x4d542865
   0x80000003 0x00: eax=0x39692029 ebx=0x3039392d ecx=0x43204b30 edx=0x40205550
   0x80000004 0x00: eax=0x362e3320 ebx=0x7a484730 ecx=0x00000000 edx=0x00000000
   0x80000005 0x00: eax=0x00000000 ebx=0x00000000 ecx=0x00000000 edx=0x00000000
   0x80000006 0x00: eax=0x00000000 ebx=0x00000000 ecx=0x01006040 edx=0x00000000
   0x80000007 0x00: eax=0x00000000 ebx=0x00000000 ecx=0x00000000 edx=0x00000100
   0x80000008 0x00: eax=0x00003027 ebx=0x00000000 ecx=0x00000000 edx=0x00000000
   0x80860000 0x00: eax=0x00000e10 ebx=0x00001388 ecx=0x00000064 edx=0x00000000
   0xc0000000 0x00: eax=0x00000e10 ebx=0x00001388 ecx=0x00000064 edx=0x00000000
